{
  "flow_schema_version": "0.1.0",
  "flow_id": "flow_fixture_onboarding_branch",
  "app_scope_id": "app_fixture_mobile",
  "flow_session_id": "fsess_onboarding_branch",
  "title": "First-run onboarding",
  "flow_actions": [
    {
      "taxonomy_id": "dig:flow.onboarding",
      "confidence": 0.87,
      "method": "path_hint",
      "layer": "L2"
    }
  ],
  "screens": [
    {
      "flow_screen_id": "fs_welcome",
      "order": 0,
      "capture_run_id": "run_ob_welcome",
      "checkion_scan_id": null,
      "primary_url": "https://app.example/onboarding/welcome"
    },
    {
      "flow_screen_id": "fs_tips",
      "order": 1,
      "capture_run_id": "run_ob_tips",
      "checkion_scan_id": null,
      "primary_url": "https://app.example/onboarding/tips"
    },
    {
      "flow_screen_id": "fs_done",
      "order": 2,
      "capture_run_id": "run_ob_done",
      "checkion_scan_id": null,
      "primary_url": "https://app.example/onboarding/done"
    },
    {
      "flow_screen_id": "fs_skip_done",
      "order": 3,
      "capture_run_id": "run_ob_skip_done",
      "checkion_scan_id": null,
      "primary_url": "https://app.example/onboarding/done?via=skip"
    }
  ],
  "edges": [
    {
      "edge_id": "fe_welcome_tips",
      "from_screen_id": "fs_welcome",
      "to_screen_id": "fs_tips",
      "trigger": {
        "kind": "seed_sequence",
        "node_id": null,
        "href": "/onboarding/tips",
        "destination_url": "https://app.example/onboarding/tips"
      },
      "hotspot": {
        "x": 100,
        "y": 900,
        "width": 200,
        "height": 56,
        "space": "viewport"
      },
      "activation": "none",
      "method": "seed_sequence",
      "confidence": 0.82,
      "provenance": { "layer": "L2" }
    },
    {
      "edge_id": "fe_tips_done",
      "from_screen_id": "fs_tips",
      "to_screen_id": "fs_done",
      "trigger": {
        "kind": "seed_sequence",
        "node_id": null,
        "href": "/onboarding/done",
        "destination_url": "https://app.example/onboarding/done"
      },
      "activation": "none",
      "method": "seed_sequence",
      "confidence": 0.82,
      "provenance": { "layer": "L2" }
    },
    {
      "edge_id": "fe_welcome_skip",
      "from_screen_id": "fs_welcome",
      "to_screen_id": "fs_skip_done",
      "trigger": {
        "kind": "seed_sequence",
        "node_id": null,
        "href": "/onboarding/done?via=skip",
        "destination_url": "https://app.example/onboarding/done?via=skip"
      },
      "hotspot": {
        "x": 20,
        "y": 40,
        "width": 80,
        "height": 32,
        "space": "viewport"
      },
      "activation": "none",
      "method": "seed_sequence",
      "confidence": 0.75,
      "provenance": { "layer": "L2" }
    }
  ]
}
